{
  "candidates": [
    {
      "artifact_available": true,
      "channel": "nightly",
      "distribution_family": "therock",
      "first_observed_at": "2026-09-07T21:24:14Z",
      "framework": "jax",
      "id": "jax:jax-rocm10:linux:nightly:10.1.0a20260822:0.11.1+rocm10.1.0a20260822:0.11.1+rocm10.1.0a20260822:cp312,cp313,cp314",
      "last_observed_at": "2026-09-07T21:36:06Z",
      "lifecycle": "current",
      "pjrt_package": "jax-rocm10-pjrt",
      "pjrt_version": "0.11.1+rocm10.1.0a20260822",
      "platform": "linux",
      "plugin_package": "jax-rocm10-plugin",
      "plugin_version": "0.11.1+rocm10.1.0a20260822",
      "python_tags": [
        "cp312",
        "cp313",
        "cp314"
      ],
      "rocm_version": "10.1.0a20260822",
      "runtime_family": "jax-rocm10",
      "source_id": "packages-nightly-archive-linux"
    },
    {
      "artifact_available": true,
      "channel": "nightly",
      "distribution_family": "therock",
      "first_observed_at": "2026-09-07T21:24:14Z",
      "framework": "jax",
      "id": "jax:jax-rocm7:linux:nightly:7.15.0a20260728:0.10.2+rocm7.15.0a20260728:0.10.2+rocm7.15.0a20260728:cp311,cp312,cp313,cp314",
      "last_observed_at": "2026-09-07T21:36:06Z",
      "lifecycle": "current",
      "pjrt_package": "jax-rocm7-pjrt",
      "pjrt_version": "0.10.2+rocm7.15.0a20260728",
      "platform": "linux",
      "plugin_package": "jax-rocm7-plugin",
      "plugin_version": "0.10.2+rocm7.15.0a20260728",
      "python_tags": [
        "cp311",
        "cp312",
        "cp313",
        "cp314"
      ],
      "rocm_version": "7.15.0a20260728",
      "runtime_family": "jax-rocm7",
      "source_id": "packages-nightly-archive-linux"
    },
    {
      "artifact_available": true,
      "channel": "stable",
      "distribution_family": "therock",
      "first_observed_at": "2026-09-07T21:24:14Z",
      "framework": "jax",
      "id": "jax:jax-rocm7:linux:stable:7.14.1:0.10.0+rocm7.14.1:0.10.0+rocm7.14.1:cp311,cp312,cp313,cp314",
      "last_observed_at": "2026-09-07T21:36:06Z",
      "lifecycle": "current",
      "pjrt_package": "jax-rocm7-pjrt",
      "pjrt_version": "0.10.0+rocm7.14.1",
      "platform": "linux",
      "plugin_package": "jax-rocm7-plugin",
      "plugin_version": "0.10.0+rocm7.14.1",
      "python_tags": [
        "cp311",
        "cp312",
        "cp313",
        "cp314"
      ],
      "rocm_version": "7.14.1",
      "runtime_family": "jax-rocm7",
      "source_id": "packages-stable-archive-linux"
    }
  ],
  "generated_at": "2026-09-07T21:36:06Z",
  "schema_version": 1,
  "sources": {
    "packages-nightly": {
      "channel": "nightly",
      "distribution_family": "therock",
      "historical_fallback": "nightly-archive",
      "id": "nightly",
      "layout": "whl-next",
      "observed_at": "2026-09-07T21:36:06Z",
      "platform": "windows",
      "retention": "rolling",
      "retention_limit": 120,
      "stream": "nightly",
      "url": "https://nightly.repo.amd.com/rocm/pytorch/whl-next/"
    },
    "packages-nightly-archive": {
      "channel": "nightly",
      "distribution_family": "therock",
      "enabled": false,
      "historical": true,
      "id": "nightly-archive",
      "layout": "whl-multi-arch",
      "observed_at": "2026-09-07T21:24:14Z",
      "platform": "windows",
      "stream": "nightly",
      "url": "https://rocm.nightlies.amd.com/whl-multi-arch/"
    },
    "packages-nightly-archive-linux": {
      "channel": "nightly",
      "distribution_family": "therock",
      "enabled": false,
      "historical": true,
      "id": "nightly-archive-linux",
      "layout": "whl-multi-arch",
      "observed_at": "2026-09-07T21:24:14Z",
      "platform": "linux",
      "stream": "nightly",
      "url": "https://rocm.nightlies.amd.com/whl-multi-arch/"
    },
    "packages-nightly-linux": {
      "channel": "nightly",
      "distribution_family": "therock",
      "historical_fallback": "nightly-archive-linux",
      "id": "nightly-linux",
      "layout": "whl-next",
      "observed_at": "2026-09-07T21:36:06Z",
      "platform": "linux",
      "retention": "rolling",
      "retention_limit": 120,
      "stream": "nightly",
      "url": "https://nightly.repo.amd.com/rocm/pytorch/whl-next/"
    },
    "packages-stable": {
      "channel": "stable",
      "distribution_family": "therock",
      "id": "stable",
      "layout": "whl-next",
      "observed_at": "2026-09-07T21:36:06Z",
      "platform": "windows",
      "retention": "forever",
      "stream": "stable",
      "url": "https://stable.repo.amd.com/rocm/pytorch/whl-next/"
    },
    "packages-stable-archive": {
      "channel": "stable",
      "distribution_family": "therock",
      "enabled": false,
      "historical": true,
      "id": "stable-archive",
      "layout": "whl-multi-arch",
      "observed_at": "2026-09-07T21:24:14Z",
      "platform": "windows",
      "stream": "stable",
      "url": "https://repo.amd.com/rocm/whl-multi-arch/"
    },
    "packages-stable-archive-linux": {
      "channel": "stable",
      "distribution_family": "therock",
      "enabled": false,
      "historical": true,
      "id": "stable-archive-linux",
      "layout": "whl-multi-arch",
      "observed_at": "2026-09-07T21:24:14Z",
      "platform": "linux",
      "stream": "stable",
      "url": "https://repo.amd.com/rocm/whl-multi-arch/"
    },
    "packages-stable-linux": {
      "channel": "stable",
      "distribution_family": "therock",
      "id": "stable-linux",
      "layout": "whl-next",
      "observed_at": "2026-09-07T21:36:06Z",
      "platform": "linux",
      "retention": "forever",
      "stream": "stable",
      "url": "https://stable.repo.amd.com/rocm/pytorch/whl-next/"
    }
  }
}
